<?xml version="1.0" encoding="UTF-8"?><openDECL xmlns:xsi="http://www.w3.org/2001/XMLSchema-instance" xmlns="http://www.tu-dresden.de" xsi:schemaLocation="http://www.tu-dresden.de openDECL.xsd"><node name="node1"></node><display-setup name="setup1"><display id="display1" stereo="none" pixel-size-x="1280" pixel-size-y="720" metric-size-x="0.256" metric-size-y="0.144"><physical><upper-left><vector x="-0.128" y="0.072" z="-0.5"></vector></upper-left><lower-left><vector x="-0.128" y="-0.072" z="-0.5"></vector></lower-left><lower-right><vector x="0.128" y="-0.072" z="-0.5"></vector></lower-right><upper-right><vector x="0.128" y="0.072" z="-0.5"></vector></upper-right></physical><virtual><upper-left><vector x="0" y="0"></vector></upper-left><lower-left><vector x="0" y="720"></vector></lower-left><lower-right><vector x="1280" y="720"></vector></lower-right><upper-right><vector x="1280" y="0"></vector></upper-right></virtual></display></display-setup></openDECL>