<?xml version="1.0" encoding="UTF-8" standalone="no"?><openDECL xmlns="http://www.tu-dresden.de" xmlns:xsi="http://www.w3.org/2001/XMLSchema-instance" xsi:schemaLocation="http://www.tu-dresden.de openDECL.xsd"><node id="node"/><display-setup id="ds"><display id="display" metric-size-x="0.128" metric-size-y="0.072" pixel-size-x="1280" pixel-size-y="720" portref="unknown" stereo="none"><physical><upper-left><vector x="-0.064" y="0.036" z="-1.0"/></upper-left><lower-left><vector x="-0.064" y="-0.036" z="-1.0"/></lower-left><lower-right><vector x="0.064" y="-0.036" z="-1.0"/></lower-right><upper-right><vector x="0.064" y="0.036" z="-1.0"/></upper-right></physical><virtual><upper-left><vector x="0" y="0"/></upper-left><lower-left><vector x="0" y="720"/></lower-left><lower-right><vector x="1280" y="720"/></lower-right><upper-right><vector x="1280" y="0"/></upper-right></virtual></display></display-setup></openDECL>