<?xml version="1.0" encoding="UTF-8"?>
<openDECL xmlns:xsi="http://www.w3.org/2001/XMLSchema-instance" xmlns="http://www.tu-dresden.de" xsi:schemaLocation="http://www.tu-dresden.de openDECL.xsd">
	<node id="Brigitte" purpose="render">
		<graphics-device id="video1">
			<port type="display" id="left"></port>
			<port type="display" id="right"></port>
		</graphics-device>
		<network-device type="ethernet" id="EA1" network="e1" address="127.0.0.1" />
	</node>
	<network id="e1" bandwidth="10 Gbit/s" subnet-mask="255.255.255.0" />
	<display-setup id="stereo" eye-distance="0.06">
		<user>
			<position>
				<vector x="0" y="0" z="0"></vector>
			</position>
			<orientation>
				<vector x="0" y="0" z="-1"></vector>
			</orientation>
		</user>
		<display id="projL" portref="left" type="projector" stereo="left-eye" pixel-size-x="1400" pixel-size-y="1050" metric-size-x="0.4" metric-size-y="0.3">
			<physical>
				<upper-left>
					<vector x="-2.0" y="0.15" z="-0.2"></vector>
				</upper-left>
				<lower-left>
					<vector x="-2.0" y="-0.15" z="-0.2"></vector>
				</lower-left>
				<lower-right>
					<vector x="-2.0" y="-0.15" z="0.2"></vector>
				</lower-right>
				<upper-right>
					<vector x="-2.0" y="0.15" z="0.2"></vector>
				</upper-right>
			</physical>
			<virtual>
				<upper-left>
					<vector x="0" y="0"></vector>
				</upper-left>
				<lower-left>
					<vector x="0" y="1050"></vector>
				</lower-left>
				<lower-right>
					<vector x="1400" y="1050"></vector>
				</lower-right>
				<upper-right>
					<vector x="1400" y="0"></vector>
				</upper-right>
			</virtual>
		</display>
		<display id="MonL" portref="left" type="monitor" stereo="left-eye" pixel-size-x="1400" pixel-size-y="1050" metric-size-x="2.72" metric-size-y="2.04">
			<physical>
				<upper-left>
					<vector x="-1.36" y="1.02" z="-1.0"></vector>
				</upper-left>
				<lower-left>
					<vector x="-1.36" y="-1.02" z="-1.0"></vector>
				</lower-left>
				<lower-right>
					<vector x="1.36" y="-1.02" z="-1.0"></vector>
				</lower-right>
				<upper-right>
					<vector x="1.36" y="1.02" z="-1.0"></vector>
				</upper-right>
			</physical>
			<virtual>
				<upper-left>
					<vector x="0" y="0"></vector>
				</upper-left>
				<lower-left>
					<vector x="0" y="1050"></vector>
				</lower-left>
				<lower-right>
					<vector x="1400" y="1050"></vector>
				</lower-right>
				<upper-right>
					<vector x="1400" y="0"></vector>
				</upper-right>
			</virtual>
		</display>
		<display id="projR" portref="right" type="projector" stereo="right-eye" pixel-size-x="1400" pixel-size-y="1050" metric-size-x="2.72" metric-size-y="2.04">
			<physical>
				<upper-left>
					<vector x="-1.36" y="1.02" z="-1.0"></vector>
				</upper-left>
				<lower-left>
					<vector x="-1.36" y="-1.02" z="-1.0"></vector>
				</lower-left>
				<lower-right>
					<vector x="1.36" y="-1.02" z="-1.0"></vector>
				</lower-right>
				<upper-right>
					<vector x="1.36" y="1.02" z="-1.0"></vector>
				</upper-right>
			</physical>
			<virtual>
				<upper-left>
					<vector x="1400" y="0"></vector>
				</upper-left>
				<lower-left>
					<vector x="1400" y="1050"></vector>
				</lower-left>
				<lower-right>
					<vector x="2800" y="1050"></vector>
				</lower-right>
				<upper-right>
					<vector x="2800" y="0"></vector>
				</upper-right>
			</virtual>
		</display>
	</display-setup>
</openDECL>
