<?xml version="1.0" encoding="UTF-8" standalone="no"?><openDECL xmlns="http://www.tu-dresden.de" xmlns:xsi="http://www.w3.org/2001/XMLSchema-instance" xsi:schemaLocation="http://www.tu-dresden.de openDECL.xsd">
	<node id="Brigitte" purpose="render">
		<graphics-device id="video1">
			<port id="left" type="display"/>
			<port id="right" type="display"/>
		</graphics-device>
		<network-device address="127.0.0.1" id="EA1" network="e1" type="ethernet"/>
	</node>
	<network bandwidth="10 Gbit/s" id="e1" subnet-mask="255.255.255.0"/>
	<display-setup eye-distance="0.06" id="stereo">
		<user>
			<position>
				<vector x="0" y="0" z="0"/>
			</position>
			<orientation>
				<vector x="0" y="0" z="-1"/>
			</orientation>
		</user>
		<display id="projL" metric-size-x="0.4" metric-size-y="0.3" pixel-size-x="1400" pixel-size-y="1050" portref="left" stereo="left-eye" type="projector">
			<physical>
				<upper-left>
					<vector x="-2.0" y="0.15" z="-0.2"/>
				</upper-left>
				<lower-left>
					<vector x="-2.0" y="-0.15" z="-0.2"/>
				</lower-left>
				<lower-right>
					<vector x="-2.0" y="-0.15" z="0.2"/>
				</lower-right>
				<upper-right>
					<vector x="-2.0" y="0.15" z="0.2"/>
				</upper-right>
			</physical>
			<virtual>
				<upper-left>
					<vector x="0" y="0"/>
				</upper-left>
				<lower-left>
					<vector x="0" y="1050"/>
				</lower-left>
				<lower-right>
					<vector x="1400" y="1050"/>
				</lower-right>
				<upper-right>
					<vector x="1400" y="0"/>
				</upper-right>
			</virtual>
		</display>
		<display id="MonL" metric-size-x="2.72" metric-size-y="2.04" pixel-size-x="1400" pixel-size-y="1050" portref="left" stereo="left-eye" type="monitor">
			<physical>
				<upper-left>
					<vector x="-1.36" y="1.02" z="-1.0"/>
				</upper-left>
				<lower-left>
					<vector x="-1.36" y="-1.02" z="-1.0"/>
				</lower-left>
				<lower-right>
					<vector x="1.36" y="-1.02" z="-1.0"/>
				</lower-right>
				<upper-right>
					<vector x="1.36" y="1.02" z="-1.0"/>
				</upper-right>
			</physical>
			<virtual>
				<upper-left>
					<vector x="0" y="0"/>
				</upper-left>
				<lower-left>
					<vector x="0" y="1050"/>
				</lower-left>
				<lower-right>
					<vector x="1400" y="1050"/>
				</lower-right>
				<upper-right>
					<vector x="1400" y="0"/>
				</upper-right>
			</virtual>
		</display>
		<display id="projR" metric-size-x="2.72" metric-size-y="2.04" pixel-size-x="1400" pixel-size-y="1050" portref="right" stereo="right-eye" type="projector">
			<physical>
				<upper-left>
					<vector x="-1.36" y="1.02" z="-1.0"/>
				</upper-left>
				<lower-left>
					<vector x="-1.36" y="-1.02" z="-1.0"/>
				</lower-left>
				<lower-right>
					<vector x="1.36" y="-1.02" z="-1.0"/>
				</lower-right>
				<upper-right>
					<vector x="1.36" y="1.02" z="-1.0"/>
				</upper-right>
			</physical>
				<upper-left>
					<vector x="1400" y="0"/>
				</upper-left>
				<lower-left>
					<vector x="1400" y="1050"/>
				</lower-left>
				<lower-right>
					<vector x="2800" y="1050"/>
				</lower-right>
				<upper-right>
					<vector x="2800" y="0"/>
				</upper-right>
			</virtual>
		</display>
	</display-setup>
</openDECL>